<?xml version="1.0" encoding="UTF-8"?>
<zahtev xmlns:xsi="http://www.w3.org/2001/XMLSchema-instance"
    xsi:noNamespaceSchemaLocation="A-1.xsd">
    <prijava>
        <broj_prijave></broj_prijave>
        <datum_podnosenja></datum_podnosenja>
    </prijava>
    <podnosilac>
        <kontakt>
            <telefon></telefon>
            <email></email>
        </kontakt>
    </podnosilac>
    <autorsko_delo>
        <naslov></naslov>
        <delo_prerade>
            <naslov_dela_prerade></naslov_dela_prerade>
            <autori>
                <autor>
                    <kontakt>
                        <telefon></telefon>
                        <email></email>
                    </kontakt>
                    <ime></ime>
                    <prezime></prezime>
                    <drzavljanstvo></drzavljanstvo>
                    <adresa>
                        <ulica></ulica>
                        <broj></broj>
                        <postanski_broj></postanski_broj>
                        <mesto></mesto>
                        <drzava></drzava>
                    </adresa>
                    <pseudonim></pseudonim>
                </autor>
            </autori>
        </delo_prerade>
        <vrsta_dela></vrsta_dela>
        <forma_zapisa_dela></forma_zapisa_dela>
        <stvoreno_u_radnom_odnosu></stvoreno_u_radnom_odnosu>
        <nacin_koriscenja></nacin_koriscenja>
        <anoniman_autor></anoniman_autor>
    </autorsko_delo>
    <prilozi>
        <prilog/>
    </prilozi>
</zahtev>